{
  "member": {
    "m_no": 1,
    "section": {
      "shape": "rectangle",
      "width_mm": 350,
      "height_mm": 350
    }
  },
  "point": {
    "index": 1
  },
  "rebar": {
    "upper": {
      "diameter_mm": 19,
      "count": 2
    },
    "lower": {
      "diameter_mm": 19,
      "count": 2
    }
  },
  "materials": {
    "group_no": 1,
    "longitudinal_grade": "SD345"
  }
}
